"Account Type","Account Number","Transaction Date","Cheque Number","Description 1","Description 2","CAD$","USD$"
Visa,4512238500177554,9/12/2008,,"MEMORIAL SQUARE CHIROPRACCALGARY AB",,-20.00,,
Visa,4512238500177554,9/14/2008,,"CALGARY COOP GROCERY #01 CALGARY AB",,-43.12,,
Visa,4512238500177554,9/16/2008,,"BOWMONT PHYSICAL THERAPY CALGARY AB",,-80.00,,
Visa,4512238500177554,9/17/2008,,"EASTSIDE DODGE CHRYSLER CALGARY AB",,-308.39,,
Visa,4512238500177554,9/18/2008,,"PAYMENT - THANK YOU / PAIEMENT - MERCI",,700.00,,
Visa,4512238500177554,9/17/2008,,"FISHMAN'S CLEANERS CALGARY AB",,-48.41,,
